{
  "ma2h_version": "0.3",
  "type": "ask",
  "created_at": "2026-06-04T17:00:00Z",
  "agent": {
    "id": "deploybot/dev-team",
    "run_id": "run_01HZXINPUT1",
    "runtime": "cli",
    "project": "web-app"
  },
  "title": "What release note should accompany the #142 deploy?",
  "priority": "normal",
  "tags": ["input", "release"],
  "idempotency_key": "release-142-note",
  "request": {
    "mode": "input",
    "schema": {
      "type": "object",
      "properties": {
        "release_note": { "type": "string" },
        "notify_users": { "type": "boolean" }
      },
      "required": ["release_note"]
    },
    "permissions": { "allow_accept": true, "allow_edit": true, "allow_respond": true, "allow_ignore": true },
    "allowed_resolvers": ["human:alice"],
    "callback": { "mode": "pull" }
  }
}
